FirstName,LastName,Title,Category,Language,Location,Type
J.K.,Rowling,Harry Potter and the Cursed Child,Fantasy,English,River House,book
J.K.,Rowling,Harry Potter and the Philosopher's Stone,Fantasy,English,River House,book
J.K.,Rowling,Harry Potter and the Chamber of Secrets,Fantasy,English,River House,book
J.K.,Rowling,Harry Potter and the Prisoner of Azkaban,Fantasy,English,River House,book
J.K.,Rowling,Harry Potter and the Goblet of Fire,Fantasy,English,River House,book
J.K.,Rowling,Harry Potter and the Order of the Phoenix,Fantasy,English,River House,book
J.K.,Rowling,Harry Potter and the Half-Blood Prince,Fantasy,English,River House,book
J.K.,Rowling,Harry Potter and the Deathly Hallows,Fantasy,English,River House,book